{
  "$schema": "https://json-schema.org/draft/2020-12/schema",
  "$id": "https://github.com/kylecheng3146/agent-ops/schemas/config.schema.json",
  "title": "Agent Ops configuration",
  "type": "object",
  "additionalProperties": false,
  "required": [
    "schemaVersion",
    "profiles",
    "verification",
    "features",
    "pathMappings",
    "securityExceptions"
  ],
  "properties": {
    "schemaVersion": {
      "const": 3
    },
    "profiles": {
      "type": "array",
      "uniqueItems": true,
      "items": {
        "enum": [
          "core",
          "advisory",
          "guardrails",
          "loop",
          "run"
        ]
      }
    },
    "reviewRoles": {
      "type": "array",
      "items": {
        "type": "object",
        "additionalProperties": false,
        "required": [
          "role",
          "targets"
        ],
        "properties": {
          "role": {
            "enum": [
              "mechanical",
              "implementation",
              "deep-reasoning",
              "independent-review"
            ]
          },
          "targets": {
            "type": "array",
            "minItems": 1,
            "uniqueItems": true,
            "items": {
              "enum": [
                "codex",
                "agy",
                "claude"
              ]
            }
          },
          "model": {
            "type": "string",
            "minLength": 1
          },
          "effort": {
            "type": "string",
            "minLength": 1
          },
          "timeoutMs": {
            "type": "integer",
            "minimum": 1
          }
        }
      }
    },
    "verification": {
      "type": "object",
      "additionalProperties": false,
      "required": [
        "commands"
      ],
      "properties": {
        "commands": {
          "type": "array",
          "items": {
            "oneOf": [
              {
                "$ref": "#/$defs/directCommand"
              },
              {
                "$ref": "#/$defs/shellCommand"
              }
            ]
          }
        },
        "acceptanceRunners": {
          "type": "array",
          "maxItems": 128,
          "items": {
            "type": "object",
            "additionalProperties": false,
            "required": [
              "id",
              "command",
              "args",
              "cwd",
              "adapter"
            ],
            "properties": {
              "id": {
                "$ref": "#/$defs/id"
              },
              "command": {
                "type": "string",
                "minLength": 1
              },
              "args": {
                "type": "array",
                "maxItems": 512,
                "items": {
                  "type": "string"
                }
              },
              "cwd": {
                "type": "string",
                "minLength": 1
              },
              "adapter": {
                "enum": [
                  "generic",
                  "node",
                  "jest",
                  "vitest",
                  "pytest",
                  "rust"
                ]
              },
              "timeoutMs": {
                "type": "integer",
                "minimum": 1,
                "maximum": 3600000
              },
              "setup": {
                "type": "array",
                "maxItems": 64,
                "items": {
                  "type": "object",
                  "additionalProperties": false,
                  "required": [
                    "command",
                    "args"
                  ],
                  "properties": {
                    "command": {
                      "type": "string",
                      "minLength": 1
                    },
                    "args": {
                      "type": "array",
                      "maxItems": 512,
                      "items": {
                        "type": "string"
                      }
                    },
                    "timeoutMs": {
                      "type": "integer",
                      "minimum": 1,
                      "maximum": 3600000
                    }
                  }
                }
              },
              "build": {
                "type": "array",
                "maxItems": 64,
                "items": {
                  "type": "object",
                  "additionalProperties": false,
                  "required": [
                    "command",
                    "args"
                  ],
                  "properties": {
                    "command": {
                      "type": "string",
                      "minLength": 1
                    },
                    "args": {
                      "type": "array",
                      "maxItems": 512,
                      "items": {
                        "type": "string"
                      }
                    },
                    "timeoutMs": {
                      "type": "integer",
                      "minimum": 1,
                      "maximum": 3600000
                    }
                  }
                }
              },
              "testBuild": {
                "type": "array",
                "maxItems": 64,
                "items": {
                  "type": "object",
                  "additionalProperties": false,
                  "required": [
                    "command",
                    "args"
                  ],
                  "properties": {
                    "command": {
                      "type": "string",
                      "minLength": 1
                    },
                    "args": {
                      "type": "array",
                      "maxItems": 512,
                      "items": {
                        "type": "string"
                      }
                    },
                    "timeoutMs": {
                      "type": "integer",
                      "minimum": 1,
                      "maximum": 3600000
                    }
                  }
                }
              }
            }
          }
        }
      }
    },
    "features": {
      "type": "object",
      "additionalProperties": false,
      "required": [
        "completionGate",
        "stopVerification"
      ],
      "properties": {
        "office": {
          "type": "object",
          "additionalProperties": false,
          "required": [
            "enabled"
          ],
          "properties": {
            "enabled": {
              "type": "boolean"
            }
          }
        },
        "completionGate": {
          "type": "object",
          "additionalProperties": false,
          "required": [
            "enabled"
          ],
          "properties": {
            "enabled": {
              "type": "boolean"
            }
          }
        },
        "stopVerification": {
          "type": "object",
          "additionalProperties": false,
          "required": [
            "enabled"
          ],
          "properties": {
            "enabled": {
              "type": "boolean"
            }
          }
        },
        "debug": {
          "type": "object",
          "description": "Pre-0.11 DEBUG budget settings; accepted, ignored and dropped by update."
        }
      }
    },
    "pathMappings": {
      "type": "array",
      "items": {
        "type": "object",
        "additionalProperties": false,
        "required": [
          "path",
          "verifierIds"
        ],
        "properties": {
          "path": {
            "$ref": "#/$defs/relativePath"
          },
          "verifierIds": {
            "type": "array",
            "uniqueItems": true,
            "items": {
              "$ref": "#/$defs/id"
            }
          }
        }
      }
    },
    "worktree": {
      "type": "object",
      "additionalProperties": false,
      "required": [
        "mode"
      ],
      "properties": {
        "mode": {
          "enum": [
            "auto",
            "off"
          ]
        },
        "setup": {
          "type": "array",
          "items": {
            "type": "object",
            "additionalProperties": false,
            "required": [
              "command",
              "args"
            ],
            "properties": {
              "command": {
                "$ref": "#/$defs/nonEmptyString"
              },
              "args": {
                "type": "array",
                "items": {
                  "type": "string",
                  "pattern": "^[^\\u0000]*$"
                }
              },
              "timeoutMs": {
                "type": "integer",
                "minimum": 1,
                "maximum": 2147483647
              }
            }
          }
        }
      }
    },
    "securityExceptions": {
      "type": "array",
      "items": {
        "type": "object",
        "additionalProperties": false,
        "required": [
          "ruleId",
          "scope",
          "expiresAt",
          "reason"
        ],
        "properties": {
          "ruleId": {
            "$ref": "#/$defs/id"
          },
          "scope": {
            "allOf": [
              {
                "$ref": "#/$defs/relativePath"
              },
              {
                "not": {
                  "const": "."
                }
              }
            ]
          },
          "expiresAt": {
            "$ref": "#/$defs/timestamp"
          },
          "reason": {
            "$ref": "#/$defs/nonEmptyString"
          }
        }
      }
    }
  },
  "allOf": [
    {
      "if": {
        "type": "object",
        "properties": {
          "features": {
            "type": "object",
            "properties": {
              "stopVerification": {
                "type": "object",
                "properties": {
                  "enabled": {
                    "const": true
                  }
                }
              }
            }
          }
        }
      },
      "then": {
        "type": "object",
        "properties": {
          "verification": {
            "type": "object",
            "properties": {
              "commands": {
                "type": "array",
                "minItems": 1
              }
            }
          }
        }
      }
    }
  ],
  "$defs": {
    "id": {
      "type": "string",
      "pattern": "^[a-z][a-z0-9-]{0,127}$"
    },
    "nonEmptyString": {
      "type": "string",
      "pattern": "[^\\s\\u0000]",
      "not": {
        "pattern": "\\u0000"
      }
    },
    "timestamp": {
      "type": "string",
      "format": "date-time",
      "pattern": "^(?!0000-)\\d{4}-\\d{2}-\\d{2}T\\d{2}:\\d{2}:[0-5]\\d(?:\\.\\d+)?(?:Z|[+-]\\d{2}:\\d{2})$",
      "$comment": "Runtime uses a case-sensitive RFC 3339 subset with years 0001-9999 and seconds 00-59; leap seconds are intentionally unsupported."
    },
    "relativePath": {
      "type": "string",
      "pattern": "^(?:\\.|(?![A-Za-z]:)(?!/)(?!.*\\\\)(?!.*(?:^|/)\\.{1,2}(?:/|$))[A-Za-z0-9._-]+(?:/[A-Za-z0-9._-]+)*)$",
      "allOf": [
        {
          "not": {
            "pattern": "(?:^|/)(?:[Aa][Uu][Xx]|[Cc][Oo][Mm][1-9]|[Cc][Oo][Nn]|[Ll][Pp][Tt][1-9]|[Nn][Uu][Ll]|[Pp][Rr][Nn])(?:\\.[A-Za-z0-9._-]*)?(?:/|$)"
          }
        },
        {
          "not": {
            "pattern": "(?:^|/)[^/]+\\.(?:/|$)"
          }
        }
      ]
    },
    "evidence": {
      "type": "object",
      "additionalProperties": false,
      "required": [
        "kind"
      ],
      "properties": {
        "kind": {
          "enum": [
            "exit-code",
            "test-count",
            "file"
          ]
        },
        "minimum": {
          "type": "integer",
          "minimum": 0,
          "maximum": 9007199254740991
        }
      }
    },
    "commandFields": {
      "type": "object",
      "required": [
        "id",
        "command",
        "args",
        "cwd",
        "required",
        "evidence"
      ],
      "properties": {
        "id": {
          "$ref": "#/$defs/id"
        },
        "command": {
          "$ref": "#/$defs/nonEmptyString"
        },
        "args": {
          "type": "array",
          "items": {
            "type": "string",
            "pattern": "^[^\\u0000]*$"
          }
        },
        "cwd": {
          "$ref": "#/$defs/relativePath"
        },
        "required": {
          "type": "boolean"
        },
        "timeoutMs": {
          "type": "integer",
          "minimum": 1,
          "maximum": 2147483647
        },
        "evidence": {
          "$ref": "#/$defs/evidence"
        }
      }
    },
    "directCommand": {
      "allOf": [
        {
          "$ref": "#/$defs/commandFields"
        },
        {
          "type": "object",
          "additionalProperties": false,
          "properties": {
            "id": true,
            "command": true,
            "args": true,
            "cwd": true,
            "required": true,
            "timeoutMs": true,
            "evidence": true,
            "shell": {
              "const": false
            }
          }
        }
      ]
    },
    "shellCommand": {
      "allOf": [
        {
          "$ref": "#/$defs/commandFields"
        },
        {
          "type": "object",
          "additionalProperties": false,
          "required": [
            "shell",
            "acknowledgeRisk"
          ],
          "properties": {
            "id": true,
            "command": true,
            "args": true,
            "cwd": true,
            "required": true,
            "timeoutMs": true,
            "evidence": true,
            "shell": {
              "const": true
            },
            "acknowledgeRisk": {
              "const": true
            }
          }
        }
      ]
    }
  },
  "$comment": "Duplicate IDs and verifier reference resolution are semantic constraints enforced by runtime validation."
}
