{
  "schemaVersion": 3,
  "profiles": ["core"],
  "verification": {
    "commands": [
      {
        "id": "test",
        "command": "npm",
        "args": ["test"],
        "cwd": ".",
        "required": true,
        "evidence": {
          "kind": "test-count",
          "minimum": 1
        }
      }
    ]
  },
  "features": {
    "stopVerification": {
      "enabled": false
    },
    "completionGate": {
      "enabled": false
    }
  },
  "pathMappings": [
    {
      "path": "src",
      "verifierIds": ["test"]
    }
  ],
  "securityExceptions": []
}
